created_at,updated_at,extras,id,name,parent_id,jurisdiction_id,classification,sources,links,other_names
2025-01-28 05:45:38.306819+00:00,2025-03-21 20:46:54.578225+00:00,{},ocd-organization/073e1b59-923c-4046-9760-e7618029f604,Foreign Affairs Committee Western Hemisphere,ocd-organization/6f645bd7-0332-5edc-82c0-6da644369bfa,ocd-jurisdiction/country:us/government,subcommittee,"[{'url': 'https://foreignaffairs.house.gov/subcommittee/western-hemisphere', 'note': ''}]","[{'url': 'https://foreignaffairs.house.gov/subcommittee/western-hemisphere', 'note': ''}]","[{'name': 'House Foreign Affairs Committee Western Hemisphere', 'end_date': '', 'start_date': ''}, {'name': 'House Foreign Affairs Committee Western Hemisphere Subcommittee', 'end_date': '', 'start_date': ''}, {'name': 'House Subcommittee on Foreign Affairs Committee Western Hemisphere', 'end_date': '', 'start_date': ''}]"
2021-07-19 16:53:42.145024+00:00,2025-03-21 20:47:00.017721+00:00,"{'type': 'house', 'phone': '(202) 225-2761', 'address': '1324A LHOB; Washington, DC 20515-6201'}",ocd-organization/128a55da-60bb-5571-8bd5-dfc312ef37a9,Natural Resources,ocd-organization/24af4233-d9b5-5933-91b2-51d29f721037,ocd-jurisdiction/country:us/government,committee,"[{'url': 'https://naturalresources.house.gov', 'note': ''}, {'url': 'https://republicans-naturalresources.house.gov', 'note': ''}, {'url': 'https://unitedstates.github.io/', 'note': ''}]","[{'url': 'https://naturalresources.house.gov', 'note': ''}, {'url': 'https://naturalresources.house.gov/', 'note': 'homepage'}, {'url': 'https://republicans-naturalresources.house.gov', 'note': ''}, {'url': 'https://republicans-naturalresources.house.gov/', 'note': 'homepage'}]","[{'name': 'House Committee on Natural Resources', 'end_date': '', 'start_date': ''}, {'name': 'House Natural Resources', 'end_date': '', 'start_date': ''}, {'name': 'House Natural Resources Committee', 'end_date': '', 'start_date': ''}]"
2023-05-15 18:02:44.045901+00:00,2025-03-21 20:47:07.356520+00:00,"{'type': 'house', 'phone': '(202) 225-4121', 'address': 'HVC304 CAPITOL; Washington, DC 20515'}",ocd-organization/644ca76e-78da-5bf9-a780-69e786d7b78c,Permanent Select Committee on Intelligence Defense Intelligence and Overhead Architecture,ocd-organization/113271fd-136d-5783-88ed-1f32a955b3ec,ocd-jurisdiction/country:us/government,subcommittee,"[{'url': 'https://intelligence.house.gov/subcommittees/defense-intelligence-and-overhead-architecture-subcommittee.htm', 'note': ''}, {'url': 'https://theunitedstates.io', 'note': ''}, {'url': 'https://unitedstates.github.io/', 'note': ''}]","[{'url': 'https://intelligence.house.gov/subcommittees/defense-intelligence-and-overhead-architecture-subcommittee.htm', 'note': ''}, {'url': 'https://theunitedstates.io', 'note': ''}, {'url': 'https://unitedstates.github.io', 'note': ''}]","[{'name': 'Defense Intelligence and Overhead Architecture', 'end_date': '', 'start_date': ''}, {'name': 'House Permanent Select Committee on Intelligence Defense Intelligence and Overhead Architecture', 'end_date': '', 'start_date': ''}, {'name': 'House Permanent Select Committee on Intelligence Defense Intelligence and Overhead Architecture Subcommittee', 'end_date': '', 'start_date': ''}, {'name': 'House Subcommittee on Permanent Select Committee on Intelligence Defense Intelligence and Overhead Architecture', 'end_date': '', 'start_date': ''}]"
2021-08-16 22:28:03.739325+00:00,2025-03-21 20:47:07.755879+00:00,"{'type': 'house', 'phone': '(202) 225-4121', 'address': 'HVC304 CAPITOL; Washington, DC 20515'}",ocd-organization/83ab36b0-46da-524c-a73f-69b9c2f65f4d,Permanent Select Committee on Intelligence National Intelligence Enterprise,ocd-organization/113271fd-136d-5783-88ed-1f32a955b3ec,ocd-jurisdiction/country:us/government,subcommittee,"[{'url': 'https://intelligence.house.gov/subcommittees/national-intelligence-enterprise-subcommittee.htm', 'note': ''}, {'url': 'https://theunitedstates.io', 'note': ''}, {'url': 'https://unitedstates.github.io/', 'note': ''}]","[{'url': 'https://intelligence.house.gov/subcommittees/national-intelligence-enterprise-subcommittee.htm', 'note': ''}, {'url': 'https://theunitedstates.io', 'note': ''}, {'url': 'https://unitedstates.github.io', 'note': ''}]","[{'name': 'House Permanent Select Committee on Intelligence National Intelligence Enterprise', 'end_date': '', 'start_date': ''}, {'name': 'House Permanent Select Committee on Intelligence National Intelligence Enterprise Subcommittee', 'end_date': '', 'start_date': ''}, {'name': 'House Subcommittee on Permanent Select Committee on Intelligence National Intelligence Enterprise', 'end_date': '', 'start_date': ''}, {'name': 'National Intelligence Enterprise', 'end_date': '', 'start_date': ''}]"
2025-01-30 02:06:58.401213+00:00,2025-03-21 20:47:08.440596+00:00,{},ocd-organization/b915b4d2-9d95-4cc9-ac3b-7d76b2198e2b,"Science, Space and Technology Committee Environment",ocd-organization/3784e5c7-f164-569f-b164-2accdc099783,ocd-jurisdiction/country:us/government,subcommittee,"[{'url': 'https://science.house.gov/subcommittee-environment', 'note': ''}]","[{'url': 'https://science.house.gov/subcommittee-environment', 'note': ''}]","[{'name': 'House Science, Space and Technology Committee Environment', 'end_date': '', 'start_date': ''}, {'name': 'House Science, Space and Technology Committee Environment Subcommittee', 'end_date': '', 'start_date': ''}, {'name': 'House Subcommittee on Science, Space and Technology Committee Environment', 'end_date': '', 'start_date': ''}]"
2025-01-30 02:06:45.402820+00:00,2025-03-21 20:47:13.090379+00:00,{},ocd-organization/1bbb624c-9ed4-4523-ae31-11e0ada7db08,Natural Resources Committee Federal Lands,ocd-organization/128a55da-60bb-5571-8bd5-dfc312ef37a9,ocd-jurisdiction/country:us/government,subcommittee,"[{'url': 'https://naturalresources.house.gov/issues/issue/?IssueID=5063', 'note': ''}]","[{'url': 'https://naturalresources.house.gov/issues/issue/?IssueID=5063', 'note': ''}]","[{'name': 'House Natural Resources Committee Federal Lands', 'end_date': '', 'start_date': ''}, {'name': 'House Natural Resources Committee Federal Lands Subcommittee', 'end_date': '', 'start_date': ''}, {'name': 'House Subcommittee on Natural Resources Committee Federal Lands', 'end_date': '', 'start_date': ''}]"
2025-01-30 02:06:41.297323+00:00,2025-03-21 20:47:14.244514+00:00,{},ocd-organization/f00f4775-0435-4e14-8544-d2784e3b018f,"Education and the Workforce Committee Early Childhood, Elementary and Secondary Education",ocd-organization/bcc3f01c-98f0-587d-9730-ff20d286f993,ocd-jurisdiction/country:us/government,subcommittee,"[{'url': 'https://edworkforce.house.gov/issues/issue/?IssueID=43419', 'note': ''}]","[{'url': 'https://edworkforce.house.gov/issues/issue/?IssueID=43419', 'note': ''}]","[{'name': 'House Education and the Workforce Committee Early Childhood, Elementary and Secondary Education', 'end_date': '', 'start_date': ''}, {'name': 'House Education and the Workforce Committee Early Childhood, Elementary and Secondary Education Subcommittee', 'end_date': '', 'start_date': ''}, {'name': 'House Subcommittee on Education and the Workforce Committee Early Childhood, Elementary and Secondary Education', 'end_date': '', 'start_date': ''}]"
2025-01-30 02:06:59.989873+00:00,2025-03-21 20:47:14.685375+00:00,{},ocd-organization/0839eb7f-f492-476f-9343-7997eb15f390,"Health, Education, Labor and Pensions Committee Education and the American Family",ocd-organization/311e8265-0627-51b0-89f2-ff5fa3304e62,ocd-jurisdiction/country:us/government,subcommittee,[],[],"[{'name': 'Health, Education, Labor and Pensions Committee Children and Families', 'end_date': '', 'start_date': ''}, {'name': 'Senate Health, Education, Labor and Pensions Committee Children and Families', 'end_date': '', 'start_date': ''}, {'name': 'Senate Health, Education, Labor and Pensions Committee Children and Families Subcommittee', 'end_date': '', 'start_date': ''}, {'name': 'Senate Health, Education, Labor and Pensions Committee Education and the American Family', 'end_date': '', 'start_date': ''}, {'name': 'Senate Health, Education, Labor and Pensions Committee Education and the American Family Subcommittee', 'end_date': '', 'start_date': ''}, {'name': 'Senate Subcommittee on Health, Education, Labor and Pensions Committee Children and Families', 'end_date': '', 'start_date': ''}, {'name': 'Senate Subcommittee on Health, Education, Labor and Pensions Committee Education and the American Family', 'end_date': '', 'start_date': ''}]"
2025-01-30 02:06:55.222108+00:00,2025-04-05 02:47:10.420567+00:00,{},ocd-organization/a58bec30-16d1-4d6f-a8c3-578fabde5496,Appropriations Committee Defense,ocd-organization/e97797e3-ac17-54b4-9e82-7dfd666af6d9,ocd-jurisdiction/country:us/government,subcommittee,"[{'url': 'https://appropriations.house.gov/subcommittees/defense-0', 'note': ''}, {'url': 'https://appropriations.house.gov/subcommittees/defense-118th-congress', 'note': ''}]","[{'url': 'https://appropriations.house.gov/subcommittees/defense-0', 'note': ''}, {'url': 'https://appropriations.house.gov/subcommittees/defense-118th-congress', 'note': ''}]","[{'name': 'House Appropriations Committee Defense', 'end_date': '', 'start_date': ''}, {'name': 'House Appropriations Committee Defense Subcommittee', 'end_date': '', 'start_date': ''}, {'name': 'House Subcommittee on Appropriations Committee Defense', 'end_date': '', 'start_date': ''}]"
2025-01-28 05:45:48.770995+00:00,2025-03-29 03:02:05.775976+00:00,{},ocd-organization/d713d9a7-27a5-499a-9e9e-d7d238f6e23d,"Financial Services Committee Monetary Policy, Treasury Market Resilience and Economic Prosperity Task Force",ocd-organization/f445a449-ae0d-5208-862c-2158070ecdb7,ocd-jurisdiction/country:us/government,subcommittee,"[{'url': 'https://financialservices.house.gov/119th-congress-subcommittees/task-force-on-monetary-policy-treasury-market-resilience-and-economic-prosperity.htm', 'note': ''}]","[{'url': 'https://financialservices.house.gov/119th-congress-subcommittees/task-force-on-monetary-policy-treasury-market-resilience-and-economic-prosperity.htm', 'note': ''}]","[{'name': 'House Committee on Financial Services Committee Monetary Policy, Treasury Market Resilience and Economic Prosperity Task Force', 'end_date': '', 'start_date': ''}, {'name': 'House Financial Services Committee Monetary Policy, Treasury Market Resilience and Economic Prosperity Task Force', 'end_date': '', 'start_date': ''}, {'name': 'House Financial Services Committee Monetary Policy, Treasury Market Resilience and Economic Prosperity Task Force Committee', 'end_date': '', 'start_date': ''}, {'name': 'House Financial Services Committee Monetary Policy, Treasury Market Resilience and Economic Prosperity Task Force Subcommittee', 'end_date': '', 'start_date': ''}, {'name': 'House Subcommittee on Financial Services Committee Monetary Policy, Treasury Market Resilience and Economic Prosperity Task Force', 'end_date': '', 'start_date': ''}]"
2025-01-30 02:06:46.722541+00:00,2025-03-29 03:02:06.062664+00:00,{},ocd-organization/2a7fb045-05fe-4eba-95d9-b0fc9b848903,Financial Services Committee Financial Institutions,ocd-organization/f445a449-ae0d-5208-862c-2158070ecdb7,ocd-jurisdiction/country:us/government,subcommittee,"[{'url': 'https://financialservices.house.gov/119th-congress-subcommittees/subcommittee-on-financial-institutions.htm', 'note': ''}]","[{'url': 'https://financialservices.house.gov/119th-congress-subcommittees/subcommittee-on-financial-institutions.htm', 'note': ''}]","[{'name': 'Financial Services Committee Financial Institutions and Monetary Policy', 'end_date': '', 'start_date': ''}, {'name': 'House Financial Services Committee Financial Institutions', 'end_date': '', 'start_date': ''}, {'name': 'House Financial Services Committee Financial Institutions and Monetary Policy', 'end_date': '', 'start_date': ''}, {'name': 'House Financial Services Committee Financial Institutions and Monetary Policy Subcommittee', 'end_date': '', 'start_date': ''}, {'name': 'House Financial Services Committee Financial Institutions Subcommittee', 'end_date': '', 'start_date': ''}, {'name': 'House Subcommittee on Financial Services Committee Financial Institutions', 'end_date': '', 'start_date': ''}, {'name': 'House Subcommittee on Financial Services Committee Financial Institutions and Monetary Policy', 'end_date': '', 'start_date': ''}]"
2025-01-28 05:46:41.337039+00:00,2025-03-29 03:02:06.947740+00:00,{},ocd-organization/d0244d7c-4011-4b5a-ab6b-15e2cfa0b9b3,"Foreign Relations Committee State Department and USAID Management, International Operations and Bilateral International Development",ocd-organization/9f3e78d9-3849-5435-8ea4-77c32657f12d,ocd-jurisdiction/country:us/government,subcommittee,"[{'url': 'https://www.foreign.senate.gov/about/subcommittees', 'note': ''}]","[{'url': 'https://www.foreign.senate.gov/about/subcommittees', 'note': ''}]","[{'name': 'Senate Foreign Relations Committee State Department and USAID Management, International Operations and Bilateral International Development', 'end_date': '', 'start_date': ''}, {'name': 'Senate Foreign Relations Committee State Department and USAID Management, International Operations and Bilateral International Development Subcommittee', 'end_date': '', 'start_date': ''}, {'name': 'Senate Subcommittee on Foreign Relations Committee State Department and USAID Management, International Operations and Bilateral International Development', 'end_date': '', 'start_date': ''}]"
2025-01-28 05:46:23.206825+00:00,2025-04-05 02:47:10.619225+00:00,{},ocd-organization/dc20569b-38f6-49e1-b18a-03e671362e06,"Appropriations Committee Agriculture, Rural Development, Food and Drug Administration and Related Agencies",ocd-organization/e97797e3-ac17-54b4-9e82-7dfd666af6d9,ocd-jurisdiction/country:us/government,subcommittee,"[{'url': 'https://appropriations.house.gov/subcommittees/agriculture-rural-development-food-and-drug-administration-and-related-agencies', 'note': ''}, {'url': 'https://appropriations.house.gov/subcommittees/agriculture-rural-development-food-and-drug-administration-and-related-agencies-118th', 'note': ''}]","[{'url': 'https://appropriations.house.gov/subcommittees/agriculture-rural-development-food-and-drug-administration-and-related-agencies', 'note': ''}, {'url': 'https://appropriations.house.gov/subcommittees/agriculture-rural-development-food-and-drug-administration-and-related-agencies-118th', 'note': ''}]","[{'name': 'House Appropriations Committee Agriculture, Rural Development, Food and Drug Administration and Related Agencies', 'end_date': '', 'start_date': ''}, {'name': 'House Appropriations Committee Agriculture, Rural Development, Food and Drug Administration and Related Agencies Subcommittee', 'end_date': '', 'start_date': ''}, {'name': 'House Subcommittee on Appropriations Committee Agriculture, Rural Development, Food and Drug Administration and Related Agencies', 'end_date': '', 'start_date': ''}]"
2025-03-29 03:01:53.569140+00:00,2025-04-24 03:01:13.560256+00:00,{},ocd-organization/170b9e85-330e-48c7-b8ff-5553df5a379f,Foreign Affairs Committee Arms Sales Task Force,ocd-organization/6f645bd7-0332-5edc-82c0-6da644369bfa,ocd-jurisdiction/country:us/government,subcommittee,[],[],"[{'name': 'House Foreign Affairs Committee Arms Sales Task Force', 'end_date': '', 'start_date': ''}, {'name': 'House Foreign Affairs Committee Arms Sales Task Force Subcommittee', 'end_date': '', 'start_date': ''}, {'name': 'House Subcommittee on Foreign Affairs Committee Arms Sales Task Force', 'end_date': '', 'start_date': ''}]"
2025-04-24 03:01:19.471415+00:00,2025-04-24 03:01:19.695268+00:00,{},ocd-organization/482c8de6-e10e-42bf-a8c2-742dae312724,Permanent Select Committee on Intelligence Cartel Task Force,ocd-organization/24af4233-d9b5-5933-91b2-51d29f721037,ocd-jurisdiction/country:us/government,committee,[],[],"[{'name': 'House Permanent Select Committee on Intelligence Cartel Task Force', 'end_date': '', 'start_date': ''}, {'name': 'House Committee on Permanent Select Committee on Intelligence Cartel Task Force', 'end_date': '', 'start_date': ''}, {'name': 'House Permanent Select Committee on Intelligence Cartel Task Force Committee', 'end_date': '', 'start_date': ''}]"
2025-01-28 05:46:46.120439+00:00,2025-04-24 03:01:24.902461+00:00,{},ocd-organization/191f961f-4e74-4c08-9fb9-e71cf06ed22a,"Small Business Committee Rural Development, Energy and Supply Chains",ocd-organization/d8493969-3cc2-560c-81f6-b2093487656d,ocd-jurisdiction/country:us/government,subcommittee,"[{'url': 'https://smallbusiness.house.gov/subcommittees/subcommittee/default.aspx?SubcommitteeID=71809', 'note': ''}]","[{'url': 'https://smallbusiness.house.gov/subcommittees/subcommittee/default.aspx?SubcommitteeID=71809', 'note': ''}]","[{'name': 'House Small Business Committee Rural Development, Energy and Supply Chains', 'end_date': '', 'start_date': ''}, {'name': 'House Small Business Committee Rural Development, Energy and Supply Chains Subcommittee', 'end_date': '', 'start_date': ''}, {'name': 'House Subcommittee on Small Business Committee Rural Development, Energy and Supply Chains', 'end_date': '', 'start_date': ''}]"
2025-01-30 02:06:51.223858+00:00,2025-04-24 03:01:25.164650+00:00,{},ocd-organization/bcd45160-48fa-492a-ac82-62dd4926ab5c,"Small Business Committee Economic Growth, Tax and Capital Access",ocd-organization/d8493969-3cc2-560c-81f6-b2093487656d,ocd-jurisdiction/country:us/government,subcommittee,"[{'url': 'https://smallbusiness.house.gov/subcommittees/subcommittee/default.aspx?SubcommitteeID=71807', 'note': ''}]","[{'url': 'https://smallbusiness.house.gov/subcommittees/subcommittee/default.aspx?SubcommitteeID=71807', 'note': ''}]","[{'name': 'House Small Business Committee Economic Growth, Tax and Capital Access', 'end_date': '', 'start_date': ''}, {'name': 'House Small Business Committee Economic Growth, Tax and Capital Access Subcommittee', 'end_date': '', 'start_date': ''}, {'name': 'House Subcommittee on Small Business Committee Economic Growth, Tax and Capital Access', 'end_date': '', 'start_date': ''}]"
2025-01-30 02:06:59.227887+00:00,2025-04-24 03:01:30.673803+00:00,{},ocd-organization/9e441215-8b98-46af-a9f8-e96b9e663d65,Oversight and Government Reform Committee Government Operations,ocd-organization/886fa939-fa3d-5cfb-94db-6d51311f5e48,ocd-jurisdiction/country:us/government,subcommittee,"[{'url': 'https://oversight.house.gov/subcommittee/government-operations', 'note': ''}]","[{'url': 'https://oversight.house.gov/subcommittee/government-operations', 'note': ''}]","[{'name': 'House Oversight and Government Reform Committee Government Operations', 'end_date': '', 'start_date': ''}, {'name': 'House Oversight and Government Reform Committee Government Operations and the Federal Workforce', 'end_date': '', 'start_date': ''}, {'name': 'House Oversight and Government Reform Committee Government Operations and the Federal Workforce Subcommittee', 'end_date': '', 'start_date': ''}, {'name': 'House Oversight and Government Reform Committee Government Operations Subcommittee', 'end_date': '', 'start_date': ''}, {'name': 'House Subcommittee on Oversight and Government Reform Committee Government Operations', 'end_date': '', 'start_date': ''}, {'name': 'House Subcommittee on Oversight and Government Reform Committee Government Operations and the Federal Workforce', 'end_date': '', 'start_date': ''}, {'name': 'Oversight and Government Reform Committee Government Operations and the Federal Workforce', 'end_date': '', 'start_date': ''}]"
2025-01-30 02:06:50.194806+00:00,2025-04-24 03:01:34.299453+00:00,{},ocd-organization/4ebeb35b-6117-4f8c-9a12-cb38e8769c81,Transportation and Infrastructure Committee Aviation,ocd-organization/b6f15ea7-32e1-50e2-9310-f3e8b6f1cc0b,ocd-jurisdiction/country:us/government,subcommittee,"[{'url': 'https://transportation.house.gov/subcommittees/subcommittee/?ID=107417', 'note': ''}]","[{'url': 'https://transportation.house.gov/subcommittees/subcommittee/?ID=107417', 'note': ''}]","[{'name': 'House Subcommittee on Transportation and Infrastructure Committee Aviation', 'end_date': '', 'start_date': ''}, {'name': 'House Transportation and Infrastructure Committee Aviation', 'end_date': '', 'start_date': ''}, {'name': 'House Transportation and Infrastructure Committee Aviation Subcommittee', 'end_date': '', 'start_date': ''}]"
2025-01-28 05:45:34.951102+00:00,2025-03-21 20:47:05.265846+00:00,{},ocd-organization/45b5e34a-b426-44f7-b4c0-bd4a11b59bfd,"Agriculture Committee Livestock, Dairy and Poultry",ocd-organization/64bc8175-ce7e-5b02-baf5-5a5d814e718c,ocd-jurisdiction/country:us/government,subcommittee,"[{'url': 'https://agriculture.house.gov/issues/issue/?IssueID=14908', 'note': ''}]","[{'url': 'https://agriculture.house.gov/issues/issue/?IssueID=14908', 'note': ''}]","[{'name': 'House Agriculture Committee Livestock, Dairy and Poultry', 'end_date': '', 'start_date': ''}, {'name': 'House Agriculture Committee Livestock, Dairy and Poultry Subcommittee', 'end_date': '', 'start_date': ''}, {'name': 'House Subcommittee on Agriculture Committee Livestock, Dairy and Poultry', 'end_date': '', 'start_date': ''}]"
2025-01-30 02:06:36.453909+00:00,2025-02-21 19:43:20.258902+00:00,{},ocd-organization/abe91282-3088-4ec8-a197-760acd50621e,Armed Services Committee Readiness and Management Support,ocd-organization/489cee51-5645-57a5-82e9-f845791d677d,ocd-jurisdiction/country:us/government,subcommittee,[],[],"[{'name': 'Senate Armed Services Committee Readiness and Management Support', 'end_date': '', 'start_date': ''}, {'name': 'Senate Armed Services Committee Readiness and Management Support Subcommittee', 'end_date': '', 'start_date': ''}, {'name': 'Senate Subcommittee on Armed Services Committee Readiness and Management Support', 'end_date': '', 'start_date': ''}]"
2025-01-28 05:45:37.189837+00:00,2025-01-30 02:06:36.889223+00:00,{},ocd-organization/725024c3-1f14-456d-8d5a-48458ae089d6,Armed Services Committee Cybersecurity,ocd-organization/489cee51-5645-57a5-82e9-f845791d677d,ocd-jurisdiction/country:us/government,subcommittee,[],[],"[{'name': 'Senate Armed Services Committee Cybersecurity', 'end_date': '', 'start_date': ''}, {'name': 'Senate Armed Services Committee Cybersecurity Subcommittee', 'end_date': '', 'start_date': ''}, {'name': 'Senate Subcommittee on Armed Services Committee Cybersecurity', 'end_date': '', 'start_date': ''}]"
2025-01-30 02:06:54.741831+00:00,2025-04-05 02:47:10.705385+00:00,{},ocd-organization/d1e57fe4-129e-4280-af12-7f1470e25385,"Appropriations Committee Commerce, Justice, Science and Related Agencies",ocd-organization/e97797e3-ac17-54b4-9e82-7dfd666af6d9,ocd-jurisdiction/country:us/government,subcommittee,"[{'url': 'https://appropriations.house.gov/subcommittees/commerce-justice-science-and-related-agencies-0', 'note': ''}, {'url': 'https://appropriations.house.gov/subcommittees/commerce-justice-science-and-related-agencies-118th-congress', 'note': ''}]","[{'url': 'https://appropriations.house.gov/subcommittees/commerce-justice-science-and-related-agencies-0', 'note': ''}, {'url': 'https://appropriations.house.gov/subcommittees/commerce-justice-science-and-related-agencies-118th-congress', 'note': ''}]","[{'name': 'House Appropriations Committee Commerce, Justice, Science and Related Agencies', 'end_date': '', 'start_date': ''}, {'name': 'House Appropriations Committee Commerce, Justice, Science and Related Agencies Subcommittee', 'end_date': '', 'start_date': ''}, {'name': 'House Subcommittee on Appropriations Committee Commerce, Justice, Science and Related Agencies', 'end_date': '', 'start_date': ''}]"
2025-01-30 02:06:40.490904+00:00,2025-02-21 19:43:16.354759+00:00,{},ocd-organization/49a701cc-e12a-4640-ab3c-231f5bde13a8,"Energy and Natural Resources Committee Public Lands, Forests and Mining",ocd-organization/8ee68103-d651-5d41-a5a1-3354e3314b91,ocd-jurisdiction/country:us/government,subcommittee,"[{'url': 'https://www.energy.senate.gov/sub-public-lands-forests-mining', 'note': ''}]","[{'url': 'https://www.energy.senate.gov/sub-public-lands-forests-mining', 'note': ''}]","[{'name': 'Senate Energy and Natural Resources Committee Public Lands, Forests and Mining', 'end_date': '', 'start_date': ''}, {'name': 'Senate Energy and Natural Resources Committee Public Lands, Forests and Mining Subcommittee', 'end_date': '', 'start_date': ''}, {'name': 'Senate Subcommittee on Energy and Natural Resources Committee Public Lands, Forests and Mining', 'end_date': '', 'start_date': ''}]"
2025-01-30 02:06:55.165432+00:00,2025-04-05 02:47:10.798887+00:00,{},ocd-organization/fadd6e03-de5f-4821-9b90-8eb8cd6865ac,Appropriations Committee Financial Services and General Government,ocd-organization/e97797e3-ac17-54b4-9e82-7dfd666af6d9,ocd-jurisdiction/country:us/government,subcommittee,"[{'url': 'https://appropriations.house.gov/subcommittees/financial-services-and-general-government-0', 'note': ''}, {'url': 'https://appropriations.house.gov/subcommittees/financial-services-and-general-government-118th-congress', 'note': ''}]","[{'url': 'https://appropriations.house.gov/subcommittees/financial-services-and-general-government-0', 'note': ''}, {'url': 'https://appropriations.house.gov/subcommittees/financial-services-and-general-government-118th-congress', 'note': ''}]","[{'name': 'House Appropriations Committee Financial Services and General Government', 'end_date': '', 'start_date': ''}, {'name': 'House Appropriations Committee Financial Services and General Government Subcommittee', 'end_date': '', 'start_date': ''}, {'name': 'House Subcommittee on Appropriations Committee Financial Services and General Government', 'end_date': '', 'start_date': ''}]"
