created_at,updated_at,extras,id,name,parent_id,jurisdiction_id,classification,sources,links,other_names
2025-01-28 05:46:12.884239+00:00,2025-02-21 19:43:17.335284+00:00,{},ocd-organization/42602107-8387-4f83-be25-7592f447edf7,Financial Services Committee Housing and Insurance,ocd-organization/f445a449-ae0d-5208-862c-2158070ecdb7,ocd-jurisdiction/country:us/government,subcommittee,"[{'url': 'https://financialservices.house.gov/118th-congress-subcommittees/subcommittee-on-housing-and-insurance.htm', 'note': ''}]","[{'url': 'https://financialservices.house.gov/118th-congress-subcommittees/subcommittee-on-housing-and-insurance.htm', 'note': ''}]","[{'name': 'House Financial Services Committee Housing and Insurance', 'end_date': '', 'start_date': ''}, {'name': 'House Financial Services Committee Housing and Insurance Subcommittee', 'end_date': '', 'start_date': ''}, {'name': 'House Subcommittee on Financial Services Committee Housing and Insurance', 'end_date': '', 'start_date': ''}]"
2025-01-28 05:46:10.652316+00:00,2025-04-14 12:54:05.092797+00:00,{},ocd-organization/601b8498-175b-4681-a227-1ed2581ea35b,"Financial Services Committee National Security, Illicit Finance and International Financial Institutions",ocd-organization/f445a449-ae0d-5208-862c-2158070ecdb7,ocd-jurisdiction/country:us/government,subcommittee,"[{'url': 'https://financialservices.house.gov/118th-congress-subcommittees/subcommittee-on-national-security-illicit-finance-and-international-financial-institutions.htm', 'note': ''}, {'url': 'https://financialservices.house.gov/subcommittees/subcommittee/?IssueID=100097', 'note': ''}]","[{'url': 'https://financialservices.house.gov/118th-congress-subcommittees/subcommittee-on-national-security-illicit-finance-and-international-financial-institutions.htm', 'note': ''}, {'url': 'https://financialservices.house.gov/subcommittees/subcommittee/?IssueID=100097', 'note': ''}]","[{'name': 'House Financial Services Committee National Security, Illicit Finance and International Financial Institutions', 'end_date': '', 'start_date': ''}, {'name': 'House Financial Services Committee National Security, Illicit Finance and International Financial Institutions Subcommittee', 'end_date': '', 'start_date': ''}, {'name': 'House Subcommittee on Financial Services Committee National Security, Illicit Finance and International Financial Institutions', 'end_date': '', 'start_date': ''}]"
2025-01-28 05:46:43.985375+00:00,2025-02-21 19:43:17.826760+00:00,{},ocd-organization/5659bcfb-149c-4fc0-b6a3-9ff6b6b2349c,"Foreign Relations Committee Western Hemisphere, Transnational Crime, Civilian Security, Democracy, Human Rights and Global Women's Issues",ocd-organization/9f3e78d9-3849-5435-8ea4-77c32657f12d,ocd-jurisdiction/country:us/government,subcommittee,[],[],"[{'name': ""Senate Foreign Relations Committee Western Hemisphere, Transnational Crime, Civilian Security, Democracy, Human Rights and Global Women's Issues"", 'end_date': '', 'start_date': ''}, {'name': ""Senate Foreign Relations Committee Western Hemisphere, Transnational Crime, Civilian Security, Democracy, Human Rights and Global Women's Issues Subcommittee"", 'end_date': '', 'start_date': ''}, {'name': ""Senate Subcommittee on Foreign Relations Committee Western Hemisphere, Transnational Crime, Civilian Security, Democracy, Human Rights and Global Women's Issues"", 'end_date': '', 'start_date': ''}]"
2025-01-28 05:46:41.759156+00:00,2025-02-21 19:43:18.054775+00:00,{},ocd-organization/6c78f85a-1c46-436b-9256-acd6bdf5876b,Foreign Relations Committee Europe and Regional Security Cooperation,ocd-organization/9f3e78d9-3849-5435-8ea4-77c32657f12d,ocd-jurisdiction/country:us/government,subcommittee,[],[],"[{'name': 'Senate Foreign Relations Committee Europe and Regional Security Cooperation', 'end_date': '', 'start_date': ''}, {'name': 'Senate Foreign Relations Committee Europe and Regional Security Cooperation Subcommittee', 'end_date': '', 'start_date': ''}, {'name': 'Senate Subcommittee on Foreign Relations Committee Europe and Regional Security Cooperation', 'end_date': '', 'start_date': ''}]"
2025-01-28 05:46:43.134268+00:00,2025-02-21 19:43:18.268176+00:00,{},ocd-organization/98c27b83-c38c-4a61-8563-70e9a5f9b1a4,Foreign Relations Committee Africa and Global Health Policy,ocd-organization/9f3e78d9-3849-5435-8ea4-77c32657f12d,ocd-jurisdiction/country:us/government,subcommittee,[],[],"[{'name': 'Senate Foreign Relations Committee Africa and Global Health Policy', 'end_date': '', 'start_date': ''}, {'name': 'Senate Foreign Relations Committee Africa and Global Health Policy Subcommittee', 'end_date': '', 'start_date': ''}, {'name': 'Senate Subcommittee on Foreign Relations Committee Africa and Global Health Policy', 'end_date': '', 'start_date': ''}]"
2025-01-28 05:46:40.915463+00:00,2025-02-21 19:43:18.370881+00:00,{},ocd-organization/9b65b8e4-f8bb-419f-8124-797983e7e76c,"Foreign Relations Committee Near East, South Asia, Central Asia and Counterterrorism",ocd-organization/9f3e78d9-3849-5435-8ea4-77c32657f12d,ocd-jurisdiction/country:us/government,subcommittee,"[{'url': 'https://www.foreign.senate.gov/about/subcommittees', 'note': ''}]","[{'url': 'https://www.foreign.senate.gov/about/subcommittees', 'note': ''}]","[{'name': 'Senate Foreign Relations Committee Near East, South Asia, Central Asia and Counterterrorism', 'end_date': '', 'start_date': ''}, {'name': 'Senate Foreign Relations Committee Near East, South Asia, Central Asia and Counterterrorism Subcommittee', 'end_date': '', 'start_date': ''}, {'name': 'Senate Subcommittee on Foreign Relations Committee Near East, South Asia, Central Asia and Counterterrorism', 'end_date': '', 'start_date': ''}]"
2025-01-28 05:46:42.710697+00:00,2025-02-21 19:43:18.478759+00:00,{},ocd-organization/ed48486c-a739-483b-a37b-aa8dc1a4e1f5,"Foreign Relations Committee Multilateral International Development, Multilateral Institutions and International Economic, Energy and Environmental Policy",ocd-organization/9f3e78d9-3849-5435-8ea4-77c32657f12d,ocd-jurisdiction/country:us/government,subcommittee,[],[],"[{'name': 'Senate Foreign Relations Committee Multilateral International Development, Multilateral Institutions and International Economic, Energy and Environmental Policy', 'end_date': '', 'start_date': ''}, {'name': 'Senate Foreign Relations Committee Multilateral International Development, Multilateral Institutions and International Economic, Energy and Environmental Policy Subcommittee', 'end_date': '', 'start_date': ''}, {'name': 'Senate Subcommittee on Foreign Relations Committee Multilateral International Development, Multilateral Institutions and International Economic, Energy and Environmental Policy', 'end_date': '', 'start_date': ''}]"
2025-02-21 19:43:18.646434+00:00,2025-02-28 22:57:26.281911+00:00,{},ocd-organization/8d2c8fc0-4d18-49e3-a6a1-2dc495999c43,"Agriculture, Nutrition and Forestry Committee Rural Development, Energy and Credit",ocd-organization/a956d1a2-9eb0-584e-9f87-e7c1725f62ea,ocd-jurisdiction/country:us/government,subcommittee,"[{'url': 'https://www.agriculture.senate.gov/about/subcommittees/#rural', 'note': ''}]","[{'url': 'https://www.agriculture.senate.gov/about/subcommittees/#rural', 'note': ''}]","[{'name': 'Senate Agriculture, Nutrition and Forestry Committee Rural Development, Energy and Credit', 'end_date': '', 'start_date': ''}, {'name': 'Senate Agriculture, Nutrition and Forestry Committee Rural Development, Energy and Credit Subcommittee', 'end_date': '', 'start_date': ''}, {'name': 'Senate Subcommittee on Agriculture, Nutrition and Forestry Committee Rural Development, Energy and Credit', 'end_date': '', 'start_date': ''}]"
2025-01-28 05:45:58.189113+00:00,2025-02-21 19:43:19.030886+00:00,{},ocd-organization/e98a2d4f-e7e4-4815-aa0c-60be57016093,"Agriculture, Nutrition and Forestry Committee Commodities, Derivatives, Risk Management and Trade",ocd-organization/a956d1a2-9eb0-584e-9f87-e7c1725f62ea,ocd-jurisdiction/country:us/government,subcommittee,[],[],"[{'name': 'Agriculture, Nutrition and Forestry Committee Commodities, Risk Management and Trade', 'end_date': '', 'start_date': ''}, {'name': 'Senate Agriculture, Nutrition and Forestry Committee Commodities, Derivatives, Risk Management and Trade', 'end_date': '', 'start_date': ''}, {'name': 'Senate Agriculture, Nutrition and Forestry Committee Commodities, Derivatives, Risk Management and Trade Subcommittee', 'end_date': '', 'start_date': ''}, {'name': 'Senate Agriculture, Nutrition and Forestry Committee Commodities, Risk Management and Trade', 'end_date': '', 'start_date': ''}, {'name': 'Senate Agriculture, Nutrition and Forestry Committee Commodities, Risk Management and Trade Subcommittee', 'end_date': '', 'start_date': ''}, {'name': 'Senate Subcommittee on Agriculture, Nutrition and Forestry Committee Commodities, Derivatives, Risk Management and Trade', 'end_date': '', 'start_date': ''}, {'name': 'Senate Subcommittee on Agriculture, Nutrition and Forestry Committee Commodities, Risk Management and Trade', 'end_date': '', 'start_date': ''}]"
2021-07-19 16:53:49.133247+00:00,2025-02-21 19:43:19.622869+00:00,"{'type': 'joint', 'phone': '(202) 225-3621', 'address': '502 FHOB; Washington, DC 20515-6453'}",ocd-organization/0b65b64c-fb0a-57e5-becc-4b0d13604ad1,Committee on Taxation,ocd-organization/98590d80-8f8a-57fa-bdfc-55d778fbd88a,ocd-jurisdiction/country:us/government,committee,"[{'url': 'https://unitedstates.github.io/', 'note': ''}, {'url': 'https://www.jct.gov', 'note': ''}]","[{'url': 'https://www.jct.gov', 'note': 'homepage'}]","[{'name': 'Joint Committee on Committee on Taxation', 'end_date': '', 'start_date': ''}, {'name': 'Joint Committee on Taxation', 'end_date': '', 'start_date': ''}, {'name': 'Joint Committee on Taxation Committee', 'end_date': '', 'start_date': ''}]"
2025-01-30 02:06:37.583658+00:00,2025-02-21 19:43:19.868054+00:00,{},ocd-organization/8e245926-7df5-4739-9ffe-36443870a034,Armed Services Committee Airland,ocd-organization/489cee51-5645-57a5-82e9-f845791d677d,ocd-jurisdiction/country:us/government,subcommittee,"[{'url': 'https://www.armed-services.senate.gov/subcommittees', 'note': ''}]","[{'url': 'https://www.armed-services.senate.gov/subcommittees', 'note': ''}]","[{'name': 'Senate Armed Services Committee Airland', 'end_date': '', 'start_date': ''}, {'name': 'Senate Armed Services Committee Airland Subcommittee', 'end_date': '', 'start_date': ''}, {'name': 'Senate Subcommittee on Armed Services Committee Airland', 'end_date': '', 'start_date': ''}]"
2025-01-30 02:06:37.172225+00:00,2025-02-21 19:43:19.983004+00:00,{},ocd-organization/d594c425-6453-431d-bd78-57968cdcdd88,Armed Services Committee Seapower,ocd-organization/489cee51-5645-57a5-82e9-f845791d677d,ocd-jurisdiction/country:us/government,subcommittee,[],[],"[{'name': 'Senate Armed Services Committee Seapower', 'end_date': '', 'start_date': ''}, {'name': 'Senate Armed Services Committee Seapower Subcommittee', 'end_date': '', 'start_date': ''}, {'name': 'Senate Subcommittee on Armed Services Committee Seapower', 'end_date': '', 'start_date': ''}]"
2025-01-30 02:06:36.924377+00:00,2025-02-21 19:43:20.149813+00:00,{},ocd-organization/94cd0e77-adb1-4506-8241-f212819f5cca,Armed Services Committee Emerging Threats and Capabilities,ocd-organization/489cee51-5645-57a5-82e9-f845791d677d,ocd-jurisdiction/country:us/government,subcommittee,[],[],"[{'name': 'Senate Armed Services Committee Emerging Threats and Capabilities', 'end_date': '', 'start_date': ''}, {'name': 'Senate Armed Services Committee Emerging Threats and Capabilities Subcommittee', 'end_date': '', 'start_date': ''}, {'name': 'Senate Subcommittee on Armed Services Committee Emerging Threats and Capabilities', 'end_date': '', 'start_date': ''}]"
2025-01-30 02:06:36.622163+00:00,2025-02-21 19:43:20.319812+00:00,{},ocd-organization/8eef57a2-6059-490a-abeb-c449a080e8ec,Armed Services Committee Personnel,ocd-organization/489cee51-5645-57a5-82e9-f845791d677d,ocd-jurisdiction/country:us/government,subcommittee,[],[],"[{'name': 'Senate Armed Services Committee Personnel', 'end_date': '', 'start_date': ''}, {'name': 'Senate Armed Services Committee Personnel Subcommittee', 'end_date': '', 'start_date': ''}, {'name': 'Senate Subcommittee on Armed Services Committee Personnel', 'end_date': '', 'start_date': ''}]"
2025-01-30 02:06:37.363418+00:00,2025-02-21 19:43:20.379763+00:00,{},ocd-organization/c29fe807-19f8-4931-819b-93059cbde841,Armed Services Committee Strategic Forces,ocd-organization/489cee51-5645-57a5-82e9-f845791d677d,ocd-jurisdiction/country:us/government,subcommittee,[],[],"[{'name': 'Senate Armed Services Committee Strategic Forces', 'end_date': '', 'start_date': ''}, {'name': 'Senate Armed Services Committee Strategic Forces Subcommittee', 'end_date': '', 'start_date': ''}, {'name': 'Senate Subcommittee on Armed Services Committee Strategic Forces', 'end_date': '', 'start_date': ''}]"
2025-01-28 05:46:51.858477+00:00,2025-02-21 19:43:20.941574+00:00,{},ocd-organization/311e32c2-5f17-4e2d-8692-c600c0216ab8,Budget Committee Oversight Task Force,ocd-organization/c9d6f979-7b13-5541-b8cd-58eab4eb60ed,ocd-jurisdiction/country:us/government,subcommittee,[],[],"[{'name': 'House Budget Committee Oversight Task Force', 'end_date': '', 'start_date': ''}, {'name': 'House Budget Committee Oversight Task Force Subcommittee', 'end_date': '', 'start_date': ''}, {'name': 'House Subcommittee on Budget Committee Oversight Task Force', 'end_date': '', 'start_date': ''}]"
2025-01-28 05:46:48.649517+00:00,2025-03-11 02:42:40.099181+00:00,{},ocd-organization/547ff6e3-09fa-4e7f-8cad-48fbae34aade,"Science, Space and Technology Committee Energy",ocd-organization/3784e5c7-f164-569f-b164-2accdc099783,ocd-jurisdiction/country:us/government,subcommittee,"[{'url': 'https://science.house.gov/subcommittee-energy', 'note': ''}]","[{'url': 'https://science.house.gov/subcommittee-energy', 'note': ''}]","[{'name': 'House Science, Space and Technology Committee Energy', 'end_date': '', 'start_date': ''}, {'name': 'House Science, Space and Technology Committee Energy Subcommittee', 'end_date': '', 'start_date': ''}, {'name': 'House Subcommittee on Science, Space and Technology Committee Energy', 'end_date': '', 'start_date': ''}]"
2025-01-30 02:06:58.246839+00:00,2025-02-21 19:43:21.358491+00:00,{},ocd-organization/0c2a91fe-46ba-407d-a23c-26cbbd96b1e5,"Science, Space and Technology Committee Research and Technology",ocd-organization/3784e5c7-f164-569f-b164-2accdc099783,ocd-jurisdiction/country:us/government,subcommittee,"[{'url': 'https://science.house.gov/subcommittee-research-technology', 'note': ''}]","[{'url': 'https://science.house.gov/subcommittee-research-technology', 'note': ''}]","[{'name': 'House Science, Space and Technology Committee Research and Technology', 'end_date': '', 'start_date': ''}, {'name': 'House Science, Space and Technology Committee Research and Technology Subcommittee', 'end_date': '', 'start_date': ''}, {'name': 'House Subcommittee on Science, Space and Technology Committee Research and Technology', 'end_date': '', 'start_date': ''}]"
2025-01-30 02:06:58.325436+00:00,2025-02-21 19:43:21.456658+00:00,{},ocd-organization/99ec55de-bdc3-40fe-8fb7-efa09b5eba53,"Science, Space and Technology Committee Space and Aeronautics",ocd-organization/3784e5c7-f164-569f-b164-2accdc099783,ocd-jurisdiction/country:us/government,subcommittee,"[{'url': 'https://science.house.gov/subcommittee-space-aeronautics', 'note': ''}]","[{'url': 'https://science.house.gov/subcommittee-space-aeronautics', 'note': ''}]","[{'name': 'House Science, Space and Technology Committee Space and Aeronautics', 'end_date': '', 'start_date': ''}, {'name': 'House Science, Space and Technology Committee Space and Aeronautics Subcommittee', 'end_date': '', 'start_date': ''}, {'name': 'House Subcommittee on Science, Space and Technology Committee Space and Aeronautics', 'end_date': '', 'start_date': ''}]"
2021-07-19 16:53:42.037412+00:00,2025-03-21 20:46:59.581142+00:00,"{'type': 'house', 'phone': '(202) 226-8417', 'address': '176 FHOB; Washington, DC 20515-6480'}",ocd-organization/1b4c8042-794d-5f20-bfb9-114bf565df17,Homeland Security,ocd-organization/24af4233-d9b5-5933-91b2-51d29f721037,ocd-jurisdiction/country:us/government,committee,"[{'url': 'https://homeland.house.gov', 'note': ''}, {'url': 'https://republicans-homeland.house.gov', 'note': ''}, {'url': 'https://unitedstates.github.io/', 'note': ''}]","[{'url': 'https://homeland.house.gov', 'note': ''}, {'url': 'https://homeland.house.gov/', 'note': 'homepage'}, {'url': 'https://republicans-homeland.house.gov', 'note': ''}, {'url': 'https://republicans-homeland.house.gov/', 'note': 'homepage'}]","[{'name': 'House Committee on Homeland Security', 'end_date': '', 'start_date': ''}, {'name': 'House Homeland Security', 'end_date': '', 'start_date': ''}, {'name': 'House Homeland Security Committee', 'end_date': '', 'start_date': ''}]"
2021-07-19 16:53:41.794144+00:00,2025-03-11 02:42:28.642707+00:00,"{'type': 'house', 'phone': '(202) 225-3625', 'address': '1139 LHOB; Washington, DC 20515-6348'}",ocd-organization/d967b173-e5a0-5585-95fc-b619b1a11e49,Ways and Means,ocd-organization/24af4233-d9b5-5933-91b2-51d29f721037,ocd-jurisdiction/country:us/government,committee,"[{'url': 'https://gop-waysandmeans.house.gov', 'note': ''}, {'url': 'https://unitedstates.github.io/', 'note': ''}, {'url': 'https://waysandmeans.house.gov', 'note': ''}]","[{'url': 'https://gop-waysandmeans.house.gov', 'note': ''}, {'url': 'https://gop-waysandmeans.house.gov/', 'note': 'homepage'}, {'url': 'https://waysandmeans.house.gov', 'note': ''}, {'url': 'https://waysandmeans.house.gov/', 'note': 'homepage'}]","[{'name': 'House Committee on Ways and Means', 'end_date': '', 'start_date': ''}, {'name': 'House Ways and Means', 'end_date': '', 'start_date': ''}, {'name': 'House Ways and Means Committee', 'end_date': '', 'start_date': ''}]"
2021-07-19 16:53:41.373545+00:00,2025-03-11 02:42:30.534965+00:00,"{'type': 'house', 'phone': '(202) 225-2771', 'address': 'H307 CAPITOL; Washington, DC 20515-6015'}",ocd-organization/e97797e3-ac17-54b4-9e82-7dfd666af6d9,Appropriations,ocd-organization/24af4233-d9b5-5933-91b2-51d29f721037,ocd-jurisdiction/country:us/government,committee,"[{'url': 'https://appropriations.house.gov', 'note': ''}, {'url': 'https://republicans-appropriations.house.gov', 'note': ''}, {'url': 'https://unitedstates.github.io/', 'note': ''}]","[{'url': 'https://appropriations.house.gov', 'note': ''}, {'url': 'https://appropriations.house.gov/', 'note': 'homepage'}, {'url': 'https://republicans-appropriations.house.gov', 'note': ''}, {'url': 'https://republicans-appropriations.house.gov/', 'note': 'homepage'}]","[{'name': 'House Appropriations', 'end_date': '', 'start_date': ''}, {'name': 'House Appropriations Committee', 'end_date': '', 'start_date': ''}, {'name': 'House Committee on Appropriations', 'end_date': '', 'start_date': ''}]"
2025-01-30 02:06:56.906470+00:00,2025-02-21 19:43:24.650876+00:00,{},ocd-organization/6916c86a-1649-4250-a7e3-10e2daffbbea,Armed Services Committee Strategic Forces,ocd-organization/8e78273f-4c90-588c-8beb-06c815e8e64d,ocd-jurisdiction/country:us/government,subcommittee,"[{'url': 'https://armedservices.house.gov/subcommittees/subcommittee/default.aspx?IssueID=14897', 'note': ''}]","[{'url': 'https://armedservices.house.gov/subcommittees/subcommittee/default.aspx?IssueID=14897', 'note': ''}]","[{'name': 'House Armed Services Committee Strategic Forces', 'end_date': '', 'start_date': ''}, {'name': 'House Armed Services Committee Strategic Forces Subcommittee', 'end_date': '', 'start_date': ''}, {'name': 'House Subcommittee on Armed Services Committee Strategic Forces', 'end_date': '', 'start_date': ''}]"
2025-01-30 02:06:57.117823+00:00,2025-02-21 19:43:24.759089+00:00,{},ocd-organization/431f7f50-bf24-4722-a34c-683bd81d58e3,Armed Services Committee Readiness,ocd-organization/8e78273f-4c90-588c-8beb-06c815e8e64d,ocd-jurisdiction/country:us/government,subcommittee,"[{'url': 'https://armedservices.house.gov/subcommittees/subcommittee/default.aspx?IssueID=14895', 'note': ''}]","[{'url': 'https://armedservices.house.gov/subcommittees/subcommittee/default.aspx?IssueID=14895', 'note': ''}]","[{'name': 'House Armed Services Committee Readiness', 'end_date': '', 'start_date': ''}, {'name': 'House Armed Services Committee Readiness Subcommittee', 'end_date': '', 'start_date': ''}, {'name': 'House Subcommittee on Armed Services Committee Readiness', 'end_date': '', 'start_date': ''}]"
2025-01-28 05:46:26.897649+00:00,2025-02-21 19:43:24.864220+00:00,{},ocd-organization/6f864197-6334-4ff2-838b-636b7c8f0b0d,"Armed Services Committee Cyber, Information Technologies and Innovation",ocd-organization/8e78273f-4c90-588c-8beb-06c815e8e64d,ocd-jurisdiction/country:us/government,subcommittee,"[{'url': 'https://armedservices.house.gov/subcommittees/subcommittee/default.aspx?IssueID=14892', 'note': ''}]","[{'url': 'https://armedservices.house.gov/subcommittees/subcommittee/default.aspx?IssueID=14892', 'note': ''}]","[{'name': 'House Armed Services Committee Cyber, Information Technologies and Innovation', 'end_date': '', 'start_date': ''}, {'name': 'House Armed Services Committee Cyber, Information Technologies and Innovation Subcommittee', 'end_date': '', 'start_date': ''}, {'name': 'House Subcommittee on Armed Services Committee Cyber, Information Technologies and Innovation', 'end_date': '', 'start_date': ''}]"
2025-01-30 02:06:57.213394+00:00,2025-02-21 19:43:25.090839+00:00,{},ocd-organization/12fa025c-fbd9-4ca6-bf9e-745d5e07ca4e,Armed Services Committee Seapower and Projection Forces,ocd-organization/8e78273f-4c90-588c-8beb-06c815e8e64d,ocd-jurisdiction/country:us/government,subcommittee,"[{'url': 'https://armedservices.house.gov/subcommittees/subcommittee/default.aspx?IssueID=14896', 'note': ''}, {'url': 'https://democrats-armedservices.house.gov/seapowerandprojectionforces', 'note': ''}]","[{'url': 'https://armedservices.house.gov/subcommittees/subcommittee/default.aspx?IssueID=14896', 'note': ''}, {'url': 'https://democrats-armedservices.house.gov/seapowerandprojectionforces', 'note': ''}]","[{'name': 'House Armed Services Committee Seapower and Projection Forces', 'end_date': '', 'start_date': ''}, {'name': 'House Armed Services Committee Seapower and Projection Forces Subcommittee', 'end_date': '', 'start_date': ''}, {'name': 'House Subcommittee on Armed Services Committee Seapower and Projection Forces', 'end_date': '', 'start_date': ''}]"
2025-01-30 02:06:32.504343+00:00,2025-02-21 19:43:25.254411+00:00,{},ocd-organization/80de32b4-13c4-4e3d-afb8-4b93a6d020c8,Administration Committee Modernization and Innovation,ocd-organization/c4a363ef-70eb-50b5-afed-c6b162a1b00b,ocd-jurisdiction/country:us/government,subcommittee,"[{'url': 'https://cha.house.gov/modernization', 'note': ''}]","[{'url': 'https://cha.house.gov/modernization', 'note': ''}]","[{'name': 'House Administration Committee Modernization and Innovation', 'end_date': '', 'start_date': ''}, {'name': 'House Administration Committee Modernization and Innovation Subcommittee', 'end_date': '', 'start_date': ''}, {'name': 'House Subcommittee on Administration Committee Modernization and Innovation', 'end_date': '', 'start_date': ''}]"
2025-01-28 05:45:30.853262+00:00,2025-02-21 19:43:25.365893+00:00,{},ocd-organization/637ed996-9b07-4b9a-b49e-ac0a89c3ae32,Administration Committee Elections,ocd-organization/c4a363ef-70eb-50b5-afed-c6b162a1b00b,ocd-jurisdiction/country:us/government,subcommittee,"[{'url': 'https://cha.house.gov/elections', 'note': ''}]","[{'url': 'https://cha.house.gov/elections', 'note': ''}]","[{'name': 'House Administration Committee Elections', 'end_date': '', 'start_date': ''}, {'name': 'House Administration Committee Elections Subcommittee', 'end_date': '', 'start_date': ''}, {'name': 'House Subcommittee on Administration Committee Elections', 'end_date': '', 'start_date': ''}]"
2025-01-30 02:06:59.495990+00:00,2025-02-21 19:43:25.736464+00:00,{},ocd-organization/835c437f-8fed-4b9f-ae49-d02c654c210d,Homeland Security and Governmental Affairs Committee Permanent Subcommittee on Investigations,ocd-organization/d49e3a38-0b00-5f65-a060-65a0f5c1541d,ocd-jurisdiction/country:us/government,subcommittee,"[{'url': 'https://www.hsgac.senate.gov/subcommittees/investigations', 'note': ''}]","[{'url': 'https://www.hsgac.senate.gov/subcommittees/investigations', 'note': ''}]","[{'name': 'Senate Homeland Security and Governmental Affairs Committee Permanent Subcommittee on Investigations', 'end_date': '', 'start_date': ''}, {'name': 'Senate Homeland Security and Governmental Affairs Committee Permanent Subcommittee on Investigations Subcommittee', 'end_date': '', 'start_date': ''}, {'name': 'Senate Subcommittee on Homeland Security and Governmental Affairs Committee Permanent Subcommittee on Investigations', 'end_date': '', 'start_date': ''}]"
2025-01-30 02:06:51.391825+00:00,2025-04-24 03:01:25.077516+00:00,{},ocd-organization/77d7ea83-c726-42e6-863f-e932bf20bac6,"Small Business Committee Oversight, Investigations and Regulations",ocd-organization/d8493969-3cc2-560c-81f6-b2093487656d,ocd-jurisdiction/country:us/government,subcommittee,"[{'url': 'https://smallbusiness.house.gov/subcommittees/subcommittee/default.aspx?SubcommitteeID=71808', 'note': ''}]","[{'url': 'https://smallbusiness.house.gov/subcommittees/subcommittee/default.aspx?SubcommitteeID=71808', 'note': ''}]","[{'name': 'House Small Business Committee Oversight, Investigations and Regulations', 'end_date': '', 'start_date': ''}, {'name': 'House Small Business Committee Oversight, Investigations and Regulations Subcommittee', 'end_date': '', 'start_date': ''}, {'name': 'House Subcommittee on Small Business Committee Oversight, Investigations and Regulations', 'end_date': '', 'start_date': ''}]"
